{
  "capability_rule_pack_version": "0.2.0",
  "case_paths": [
    "cases/cal-conflicting-control-bilingual/case.json",
    "cases/cal-incomplete-coverage-en/case.json",
    "cases/cal-near-miss-approval-001-zh/case.json",
    "cases/cal-near-miss-autonetwork-001-en/case.json",
    "cases/cal-near-miss-autoprod-001-zh/case.json",
    "cases/cal-near-miss-autosecret-001-en/case.json",
    "cases/cal-near-miss-capchain-001-zh/case.json",
    "cases/cal-near-miss-capchain-002-en/case.json",
    "cases/cal-near-miss-capchain-003-zh/case.json",
    "cases/cal-near-miss-capchain-004-en/case.json",
    "cases/cal-near-miss-capchain-005-bilingual/case.json",
    "cases/cal-near-miss-capchain-006-en/case.json",
    "cases/cal-near-miss-capchain-007-zh/case.json",
    "cases/cal-near-miss-capchain-008-en/case.json",
    "cases/cal-near-miss-capchain-009-zh/case.json",
    "cases/cal-near-miss-capchain-010-bilingual/case.json",
    "cases/cal-near-miss-capchain-011-zh/case.json",
    "cases/cal-near-miss-capchain-012-en/case.json",
    "cases/cal-near-miss-capchain-013-zh/case.json",
    "cases/cal-near-miss-capchain-014-en/case.json",
    "cases/cal-near-miss-capchain-015-bilingual/case.json",
    "cases/cal-near-miss-capchain-016-en/case.json",
    "cases/cal-near-miss-capchain-017-zh/case.json",
    "cases/cal-near-miss-capchain-018-en/case.json",
    "cases/cal-near-miss-capchain-019-zh/case.json",
    "cases/cal-near-miss-capchain-020-bilingual/case.json",
    "cases/cal-near-miss-capchain-021-zh/case.json",
    "cases/cal-near-miss-chain-001-zh/case.json",
    "cases/cal-near-miss-coverage-001-en/case.json",
    "cases/cal-near-miss-delegate-001-zh/case.json",
    "cases/cal-near-miss-delegateexternal-001-en/case.json",
    "cases/cal-near-miss-delegatepersist-001-zh/case.json",
    "cases/cal-near-miss-external-001-en/case.json",
    "cases/cal-near-miss-externalexec-001-zh/case.json",
    "cases/cal-near-miss-externalprivileged-001-en/case.json",
    "cases/cal-near-miss-externalprod-001-zh/case.json",
    "cases/cal-near-miss-externalprod-002-en/case.json",
    "cases/cal-near-miss-externalprod-003-zh/case.json",
    "cases/cal-near-miss-externalprod-004-en/case.json",
    "cases/cal-near-miss-externalprod-005-bilingual/case.json",
    "cases/cal-near-miss-externalprod-006-en/case.json",
    "cases/cal-near-miss-externalprod-007-zh/case.json",
    "cases/cal-near-miss-externalprod-008-en/case.json",
    "cases/cal-near-miss-externalprod-009-zh/case.json",
    "cases/cal-near-miss-externalprod-010-bilingual/case.json",
    "cases/cal-near-miss-externalprod-011-zh/case.json",
    "cases/cal-near-miss-externalprod-012-en/case.json",
    "cases/cal-near-miss-externalprod-027-zh/case.json",
    "cases/cal-near-miss-externalprod-028-en/case.json",
    "cases/cal-near-miss-externalprod-029-zh/case.json",
    "cases/cal-near-miss-externalprod-030-bilingual/case.json",
    "cases/cal-near-miss-externalunverified-001-zh/case.json",
    "cases/cal-near-miss-externalwrite-001-en/case.json",
    "cases/cal-near-miss-memorynetwork-001-zh/case.json",
    "cases/cal-near-miss-memoryprod-001-en/case.json",
    "cases/cal-near-miss-memorysecret-001-zh/case.json",
    "cases/cal-near-miss-nonetworkpolicy-001-en/case.json",
    "cases/cal-near-miss-nosandbox-001-zh/case.json",
    "cases/cal-near-miss-nosecret-001-en/case.json",
    "cases/cal-near-miss-persist-001-zh/case.json",
    "cases/cal-near-miss-prodadmin-001-en/case.json",
    "cases/cal-near-miss-prodauto-001-zh/case.json",
    "cases/cal-near-miss-prodauto-002-en/case.json",
    "cases/cal-near-miss-prodauto-003-zh/case.json",
    "cases/cal-near-miss-prodauto-004-en/case.json",
    "cases/cal-near-miss-prodauto-005-bilingual/case.json",
    "cases/cal-near-miss-prodauto-006-en/case.json",
    "cases/cal-near-miss-prodauto-007-zh/case.json",
    "cases/cal-near-miss-prodauto-008-en/case.json",
    "cases/cal-near-miss-prodauto-009-zh/case.json",
    "cases/cal-near-miss-prodauto-010-bilingual/case.json",
    "cases/cal-near-miss-prodauto-011-zh/case.json",
    "cases/cal-near-miss-prodauto-012-en/case.json",
    "cases/cal-near-miss-prodauto-013-zh/case.json",
    "cases/cal-near-miss-prodauto-014-en/case.json",
    "cases/cal-near-miss-prodauto-015-bilingual/case.json",
    "cases/cal-near-miss-prodauto-016-en/case.json",
    "cases/cal-near-miss-prodauto-017-zh/case.json",
    "cases/cal-near-miss-prodauto-018-en/case.json",
    "cases/cal-near-miss-prodauto-019-zh/case.json",
    "cases/cal-near-miss-prodauto-020-bilingual/case.json",
    "cases/cal-near-miss-prodexec-001-zh/case.json",
    "cases/cal-near-miss-prodidentity-001-en/case.json",
    "cases/cal-near-miss-prodwrite-001-zh/case.json",
    "cases/cal-near-miss-relationunknown-001-en/case.json",
    "cases/cal-near-miss-requirednofilter-001-zh/case.json",
    "cases/cal-near-miss-requirednotimeout-001-en/case.json",
    "cases/cal-near-miss-secretprod-001-zh/case.json",
    "cases/cal-negative-capchain-022-en/case.json",
    "cases/cal-negative-capchain-023-zh/case.json",
    "cases/cal-negative-capchain-024-en/case.json",
    "cases/cal-negative-capchain-025-bilingual/case.json",
    "cases/cal-negative-externalprod-013-zh/case.json",
    "cases/cal-negative-externalprod-014-en/case.json",
    "cases/cal-negative-externalprod-015-bilingual/case.json",
    "cases/cal-negative-externalprod-016-en/case.json",
    "cases/cal-negative-externalprod-017-zh/case.json",
    "cases/cal-negative-externalprod-018-en/case.json",
    "cases/cal-negative-externalprod-019-zh/case.json",
    "cases/cal-negative-externalprod-020-bilingual/case.json",
    "cases/cal-negative-externalprod-021-zh/case.json",
    "cases/cal-negative-externalprod-022-en/case.json",
    "cases/cal-negative-externalprod-023-zh/case.json",
    "cases/cal-negative-externalprod-024-en/case.json",
    "cases/cal-negative-externalprod-025-bilingual/case.json",
    "cases/cal-negative-externalprod-026-en/case.json",
    "cases/cal-negative-prodauto-021-zh/case.json",
    "cases/cal-negative-prodauto-022-en/case.json",
    "cases/cal-negative-prodauto-023-zh/case.json",
    "cases/cal-negative-prodauto-024-en/case.json",
    "cases/cal-negative-prodauto-025-bilingual/case.json",
    "cases/cal-positive-approval-001-en/case.json",
    "cases/cal-positive-autonetwork-001-zh/case.json",
    "cases/cal-positive-autoprod-001-en/case.json",
    "cases/cal-positive-autosecret-001-zh/case.json",
    "cases/cal-positive-capchain-001-en/case.json",
    "cases/cal-positive-capchain-002-zh/case.json",
    "cases/cal-positive-capchain-003-en/case.json",
    "cases/cal-positive-capchain-004-zh/case.json",
    "cases/cal-positive-capchain-005-bilingual/case.json",
    "cases/cal-positive-capchain-006-zh/case.json",
    "cases/cal-positive-capchain-007-en/case.json",
    "cases/cal-positive-capchain-008-zh/case.json",
    "cases/cal-positive-capchain-009-en/case.json",
    "cases/cal-positive-capchain-010-bilingual/case.json",
    "cases/cal-positive-capchain-011-en/case.json",
    "cases/cal-positive-capchain-012-zh/case.json",
    "cases/cal-positive-capchain-013-en/case.json",
    "cases/cal-positive-capchain-014-zh/case.json",
    "cases/cal-positive-capchain-015-bilingual/case.json",
    "cases/cal-positive-capchain-016-zh/case.json",
    "cases/cal-positive-capchain-017-en/case.json",
    "cases/cal-positive-capchain-018-zh/case.json",
    "cases/cal-positive-capchain-019-en/case.json",
    "cases/cal-positive-capchain-020-bilingual/case.json",
    "cases/cal-positive-capchain-021-en/case.json",
    "cases/cal-positive-capchain-022-zh/case.json",
    "cases/cal-positive-capchain-023-en/case.json",
    "cases/cal-positive-capchain-024-zh/case.json",
    "cases/cal-positive-capchain-025-bilingual/case.json",
    "cases/cal-positive-chain-001-en/case.json",
    "cases/cal-positive-coverage-001-zh/case.json",
    "cases/cal-positive-delegate-001-en/case.json",
    "cases/cal-positive-delegateexternal-001-zh/case.json",
    "cases/cal-positive-delegatepersist-001-en/case.json",
    "cases/cal-positive-external-001-zh/case.json",
    "cases/cal-positive-externalexec-001-en/case.json",
    "cases/cal-positive-externalprivileged-001-zh/case.json",
    "cases/cal-positive-externalprod-001-en/case.json",
    "cases/cal-positive-externalprod-002-zh/case.json",
    "cases/cal-positive-externalprod-003-en/case.json",
    "cases/cal-positive-externalprod-004-zh/case.json",
    "cases/cal-positive-externalprod-005-bilingual/case.json",
    "cases/cal-positive-externalprod-006-zh/case.json",
    "cases/cal-positive-externalprod-007-en/case.json",
    "cases/cal-positive-externalprod-008-zh/case.json",
    "cases/cal-positive-externalprod-009-en/case.json",
    "cases/cal-positive-externalprod-010-bilingual/case.json",
    "cases/cal-positive-externalprod-011-en/case.json",
    "cases/cal-positive-externalprod-012-zh/case.json",
    "cases/cal-positive-externalprod-013-en/case.json",
    "cases/cal-positive-externalprod-014-zh/case.json",
    "cases/cal-positive-externalprod-015-bilingual/case.json",
    "cases/cal-positive-externalprod-016-zh/case.json",
    "cases/cal-positive-externalprod-017-en/case.json",
    "cases/cal-positive-externalprod-018-zh/case.json",
    "cases/cal-positive-externalprod-019-en/case.json",
    "cases/cal-positive-externalprod-020-bilingual/case.json",
    "cases/cal-positive-externalprod-021-en/case.json",
    "cases/cal-positive-externalprod-022-zh/case.json",
    "cases/cal-positive-externalprod-023-en/case.json",
    "cases/cal-positive-externalprod-024-zh/case.json",
    "cases/cal-positive-externalprod-025-bilingual/case.json",
    "cases/cal-positive-externalunverified-001-en/case.json",
    "cases/cal-positive-externalwrite-001-zh/case.json",
    "cases/cal-positive-memorynetwork-001-en/case.json",
    "cases/cal-positive-memoryprod-001-zh/case.json",
    "cases/cal-positive-memorysecret-001-en/case.json",